{
  "MMSI": "215811000",
  "IMO": "9839272",
  "SHIP_ID": "5410912",
  "SHIPNAME": "EVER GIVEN",
  "CALLSIGN": "9HA3938",
  "FLAG": "PA",
  "SHIPTYPE": "70",
  "TYPE_NAME": "Container Ship",
  "LAT": "31.2580",
  "LON": "32.3475",
  "SPEED": "127",
  "COURSE": "12",
  "HEADING": "10",
  "STATUS": "0",
  "DESTINATION": "ROTTERDAM",
  "ETA_AIS": "2026-06-08T07:00:00Z",
  "ETA_PREDICTED": "2026-06-09T15:42:00Z",
  "DSRC": "TER",
  "TIMESTAMP": "2026-05-25T14:30:12Z",
  "LENGTH": "399",
  "WIDTH": "59",
  "DWT": "199629",
  "GRT": "220940",
  "DRAUGHT": "159",
  "CURRENT_PORT": "Port Said",
  "LAST_PORT": "Singapore",
  "NEXT_PORT_NAME": "Rotterdam",
  "NEXT_PORT_UNLOCODE": "NLRTM"
}
